Idweb,Short_ref,full_plants,full_insects,full_inter,dipt_plants,dipt_insects,dipt_inter,hymeno_plants,hymeno_insects,hymeno_inter,Mean_T_IPCC,T_Seasonality_IPCC,Tot_Rainfall_IPCC,Rainfall_Seasonality_IPCC,HF,Annual_time_span,Sampling_time,Sampling_effort,Sampling_type,taxo_full_sp_perc,Location,Country_location,Latitude_dec,Longitude_dec,Year,Complete_ref,Source
104,"Trojelsgaard et al., 2015",11,60,100,7,22,33,11,28,52,21,"2,859",44,104,10,71,"42,1","0,064",TO,"39,44",Western Sahara, Western Sahara,"26,16","-14,42",2010,"Trøjelsgaard, K., Jordano, P., Carstensen, D. W., & Olesen, J. M. (2015). Geographical variation in mutualistic networks: Similarity, turnover and partner fidelity. Proceedings of the Royal Society B: Biological Sciences, 282(1802), 1–9. ",DRYAD:  http://dx.doi.org/10.5061/dryad.76173
106,"Vanbergen et al., 2014",29,104,325,29,78,272,9,9,20,"7,6","4,196",761,15,28,99,"23,1","0,008",T,"69,17","northern Scotland, UK", UK,"57,08","-2,76",2009,"Vanbergen, A. J., Woodcock, B. A., Gray, A., Grant, F., Telford, A., Lambdon, P., … Cavers, S. (2014). Grazing alters insect visitation networks and plant mating systems. Functional Ecology, 28(1), 178–189. ",NERC Environmental Information Data Centre (EIDC): https://doi.org/10.5285/4c058d1f-6166-4606-88a2-d2feaf036a2f. 
108,"Olesen et al., 2008",31,76,456,31,60,388,5,2,5,"-14,2","9,5",349,18,0,69,500,"0,212",TO,"73,83","Zackenberg, northeastern Greenland", Greenland,"74,5",-21,1997,"Olesen, J. M., Bascompte, J., Elberling, H., & Jordano, P. (2008). Temporal dynamics in a pollination network. Ecology, 89(6), 1573–1582. ",Web of life: ecological networks database (http://www.web-of-life.es/)
111,"Yoshihara et al., 2008",19,35,72,15,18,31,10,9,16,"0,6","14,143",243,111,8,90,270,"0,406",T,"37,04","Tumentsogt soum, Sukhbaatar province, Mongolia", Mongolia,"47,66","112,43",2005,"Yoshihara, Y., Chimeddorj, B., Buuveibaatar, B., Lhagvasuren, B., & Takatsuki, S. (2008). Effects of livestock grazing on pollination on a steppe in eastern Mongolia. Biological Conservation, 141(9), 2376–2386",original publication
112,"Watts et al., 2016 ",120,143,597,94,76,353,54,17,91,"9,1","1,211",736,79,13,213,90,"0,005",T,"25,86","Vilcanota Highlands, south-eastern Peru",Peru,"-13,22","-72,22",2002,"Watts, S., Dormann, C. F., Martín González, A. M., & Ollerton, J. (2016). The influence of floral traits on specialization and modularity of plant-pollinator networks in a biodiversity hotspot in the Peruvian Andes. Annals of Botany, 118(3), 415–429. ",original publication + thesis
115,"Kato et al., 1993",91,351,871,63,70,245,65,48,201,"3,7","8,329",2218,51,16,122,108,"0,003",T,"57,92","Mt. Kushigata, Yamanashi Prefecture, Japan", Japan,"35,59","138,37",1991,"Kato, M., Matsumoto, M., & Kato, T. (1993). Flowering Phenology and Anthophilous Insect Community in the Cool-Temperate Subalpine Forests and Meadows at Mt. Kushigata in the Central Part of Japan. Contribution from Biological Laboratory Kyoto University, 28, 119–172.",Web of life: ecological networks database (http://www.web-of-life.es/)
116,"Kato & Miura, 1996",64,190,431,46,65,172,43,50,124,"14,5","8,093",2313,22,68,183,78,"0,006",T,"73,62","Tsuruga, Japan", Japan,"35,66","136,09",1995,"Kato, M., & Miura, R. (1996). Flowering phenology and anthophilous insect community at a threatened natural lowland marsh at Nakaikemi in Tsuruga, Japan. Contribution from Biological Laboratory Kyoto University, 29(31), 1–48. ",Web of life: ecological networks database (http://www.web-of-life.es/)
117,"Kakutani et al., 1990",113,317,773,47,24,83,93,101,345,"15,1","8,173",1722,41,92,210,131,"0,004",T,"64,42","Kyoto University, Kyoto, Japan", Japan,"35,03","135,79",1987,"Kakutani, T., Inoue, T., Kato, M., & Ichihashi, H. (1990). Insect-flower relationship in the Campus of Kyoto University: an overview of the flowering phenology and the seasonal pattern of insect visits. Contribution from Biological Laboratory Kyoto University, 27(20), 465–521. ",Web of life: ecological networks database (http://www.web-of-life.es/)
118,Inoue et al 1990,114,869,1919,84,79,325,91,149,557,"11,8","8,293",1874,37,42,210,282,"0,003",T,"42,42","Kibune, Kyoto, Japan", Japan,"35,14","135,77",1987,"Inoue, T., Kato, M., Kakutani, T., Suka, T., & Itino, T. (1990). Insect-flower Relationship in the Temperate Deciduous Forest of Kibune, Kyoto: An Overview of the Flowering Phenology and the Seasonal Pattern of Insect Visits. Contr. Biol, Lab. Kyoto Univ, 27, 377–463. ",Web of life: ecological networks database (http://www.web-of-life.es/)
120,"Fragoso, 2014",56,163,315,24,50,93,46,73,162,"21,8","1,945",1331,76,42,336,396,"0,043",T,"25,57",Brazil,Brazil,"-21,28","-48,39",2012,"Fragoso, F. P. (2014). Restabelecimento das interações entre plantas e visitantes florais em áreas restauradas de Floresta Estacional Semidecidual. Universidade de Sao Paulo.",PhD thesis
121,"Popic, 2013",16,41,73,5,7,7,16,23,51,"23,8","5,906",216,64,4,65,"29,6","0,045",TO,"42,11","Carlo Station, Simpson Desert, Australia", Australia,"-23,48","138,5",2007,"Popic, T. J. (2013). Pollination networks: dynamic responses to rain-driven resource pulses. The University of Sydney.",Chapter 6 PhD thesis
122,"Pfeiffer, 2012",79,245,1132,68,78,424,69,103,466,"4,8","5,845",1962,65,3,91,"165,2","0,009",T,"55,86"," Western Cascades Range, USA", USA,"44,29","-122,1",2011,"Pfeiffer, V. W. (2012). Influence of Spatial and Temporal Factors on Plants, Pollinators and Plant-pollinator Interactions in Montane Meadows of the Western Cascades Range. Oregon State University",MsC thesis
123,"Carstensen et al., 2014 ",92,194,738,28,37,84,89,103,530,"18,8","1,815",1574,82,10,91,252,"0,014",T,"41,61","National Park of Serra do Cipó, SE Brazil", Brazil,"-19,26","-43,56",2012,"Carstensen, D. W., Sabatino, M., Trøjelsgaard, K., & Morellato, L. P. C. (2014). Beta diversity of plant-pollinator networks and the spatial turnover of pairwise interactions. PLoS ONE, 9(11). ",original publication + data in Carstensen et al 2017
124,"Pornon et al., 2017",26,78,152,19,41,77,17,18,47,"6,1","5,419",1128,13,10,30,12,"0,006",T,"90,38",French Central Pyrenees,France,"42,78","1,93",2012,"Pornon, A., Andalo, C., Burrus, M., & Escaravage, N. (2017). DNA metabarcoding data unveils invisible pollination networks. Scientific Reports, 7(1), 1–11. ",original publication + Pornon et al 2016
125,"Orford et al., 2016",32,115,246,30,74,174,9,18,32,"9,1","4,667",849,17,47,120,"40,5","0,011",T,"88,44",South-West England,UK,"51,23","-2,46",2013,"Orford, K. A., Murray, P. J., Vaughan, I. P., & Memmott, J. (2016). Modest enhancements to conventional grassland diversity improve the provision of pollination services. Journal of Applied Ecology, 53(3), 906–915. ",original publication
126,"Blumel et al., 2016",18,112,278,14,40,100,15,43,92,"9,7","5,875",872,13,74,91,"24,8","0,012",T,"90,77","Görscheider Wiese, district of Dusseldorf, Germany", Germany,"51,34","6,96",2015,"Blümel, S., Diestelhorst, O., & Lunau, K. (2016). The Pollination Network of the Görscheider Wiese – a Nature Reserve in Heiligenhaus ( NRW ). Entomologie Heute, 28, 95–115.",original publication
127,"Welti & Joern, 2018",42,348,940,33,102,269,40,117,293,"11,9","9,949",872,51,14,31,48,"0,003",T,"28,97","Konza Prairie Biological Station, Kansas, USA", USA,"39,08","-96,58",2014,"Welti, E. A. R., & Joern, A. (2018). Fire and grazing modulate the structure and resistance of plant–floral visitor networks in a tallgrass prairie. Oecologia, 186(2), 517–528. ",original publication
128,"Kantsa, 2018",38,168,403,21,37,83,34,85,180,"16,5","6,082",620,79,16,122,"46,7","0,007",T,"68,45","Lesvos Island, Greece", Greece,"39,3","26,39",2012,"Kantsa, A., Raguso, R.A., Dyer, A.G., Olesen, J.M., Tscheulin, T. & Petanidou, T. (2018). Disentangling the role of floral sensory stimuli in pollination networks. Nat. Commun., 9",original publication
130,"Souza et al., 2018",104,131,343,17,24,39,97,81,273,"22,4","1,413",1649,66,4,365,560,"0,041",TO,"52,34","Emas National Park–PNE, Brazil", Brazil,"-18,1","-52,94",2009,"Souza, C. S., Maruyama, P. K., Aoki, C., Sigrist, M. R., Raizer, J., Gross, C. L., & de Araujo, A. C. (2018). Temporal variation in plant–pollinator networks from seasonal tropical environments: Higher specialization when resources are scarce. Journal of Ecology, 106(6), 2409–2420. ",original publication
131,"Souza et al., 2018",61,88,216,27,21,54,46,36,107,25,"2,856",1295,40,6,365,384,"0,072",TO,"57,05","Retiro Conceição farm, Porto Murtinho municipality, Brazil", Brazil,"-21,68","-57,78",2010,"Souza, C. S., Maruyama, P. K., Aoki, C., Sigrist, M. R., Raizer, J., Gross, C. L., & de Araujo, A. C. (2018). Temporal variation in plant–pollinator networks from seasonal tropical environments: Higher specialization when resources are scarce. Journal of Ecology, 106(6), 2409–2420. ",original publication
132,"Souza et al., 2018",98,65,277,22,10,28,87,44,228,"25,7","2,215",1212,58,22,365,576,"0,09",TO,"57,67",", Miranda subregion of South Pantanal, Brazil", Brazil,"-19,57","-57,02",2015,"Souza, C. S., Maruyama, P. K., Aoki, C., Sigrist, M. R., Raizer, J., Gross, C. L., & de Araujo, A. C. (2018). Temporal variation in plant–pollinator networks from seasonal tropical environments: Higher specialization when resources are scarce. Journal of Ecology, 106(6), 2409–2420. ",original publication
133,"Souza et al., 2018",25,108,174,12,42,54,22,57,106,"23,3","1,612",1452,51,22,365,288,"0,107",TO,"33,08","Campo Grande municipality, private natural reserve “Guariroba”, Brazil", Brazil,"-20,54","-54,4",2013,"Souza, C. S., Maruyama, P. K., Aoki, C., Sigrist, M. R., Raizer, J., Gross, C. L., & de Araujo, A. C. (2018). Temporal variation in plant–pollinator networks from seasonal tropical environments: Higher specialization when resources are scarce. Journal of Ecology, 106(6), 2409–2420. ",original publication
141,"Simanonok & Burkle, 2014",45,127,404,36,53,189,42,43,142,"-3,1","7,275",778,17,22,62,282,"0,049",TO,"39,53","Beartooth Plateau (Montana and Wyoming), USA", USA,45,"-109,42",2012,"Simanonok, M. P., & Burkle, L. A. (2014). Partitioning interaction turnover among alpine pollination networks: Spatial, temporal, and environmental patterns. Ecosphere, 5(11), 1–17. ",original publication
154,"Traveset et al., 2013",18,60,125,14,22,57,12,8,22,"24,3","1,44",627,40,3,30,"103,6","0,096",T,"61,54","Fernandina Island, Galapagos", Galapagos Archipelago (Ecuador),"-0,31","-91,66",2011,"Traveset, A., Heleno, R., Chamorro, S., Vargas, P., Mcmullen, C. K., Castro-Urgal, R., … Olesen, J. M. (2013). Invaders of pollination networks in the Galápagos Islands: Emergence of novel communities. Proceedings of the Royal Society B: Biological Sciences, 280(1758) ; Nnakenyi, C. A., Traveset, A., Heleno, R., Minoarivelo, H. O., & Hui, C. (2019). Fine-tuning the nested structure of pollination networks by adaptive interaction switching, biogeography and sampling effect in the Galápagos Islands. Oikos, 128(10), 1413–1423.",original publication
155,"Traveset et al., 2013",20,70,127,17,17,40,9,7,17,"24,4","1,313",644,32,3,30,"103,6","0,074",T,"63,33","Pinta Island, Galapagos", Galapagos Archipelago (Ecuador),"0,54","-90,73",2011,"Traveset, A., Heleno, R., Chamorro, S., Vargas, P., Mcmullen, C. K., Castro-Urgal, R., … Olesen, J. M. (2013). Invaders of pollination networks in the Galápagos Islands: Emergence of novel communities. Proceedings of the Royal Society B: Biological Sciences, 280(1758) ; Nnakenyi, C. A., Traveset, A., Heleno, R., Minoarivelo, H. O., & Hui, C. (2019). Fine-tuning the nested structure of pollination networks by adaptive interaction switching, biogeography and sampling effect in the Galápagos Islands. Oikos, 128(10), 1413–1423.",original publication
156,"Traveset et al., 2013",24,67,164,16,17,39,19,9,34,"23,5","1,48",567,41,3,30,"103,6","0,064",T,"71,43","Santiago Island, Galapagos", Galapagos Archipelago (Ecuador),"-0,21","-90,82",2011,"Traveset, A., Heleno, R., Chamorro, S., Vargas, P., Mcmullen, C. K., Castro-Urgal, R., … Olesen, J. M. (2013). Invaders of pollination networks in the Galápagos Islands: Emergence of novel communities. Proceedings of the Royal Society B: Biological Sciences, 280(1758) ; Nnakenyi, C. A., Traveset, A., Heleno, R., Minoarivelo, H. O., & Hui, C. (2019). Fine-tuning the nested structure of pollination networks by adaptive interaction switching, biogeography and sampling effect in the Galápagos Islands. Oikos, 128(10), 1413–1423.",original publication
157,"Traveset et al., 2013",23,74,212,12,18,30,21,11,89,"23,5","1,747",371,72,12,30,"103,6","0,061",T,"64,95","Santa Cruz Island, Galapagos", Galapagos Archipelago (Ecuador),"-0,75","-90,32",2011,"Traveset, A., Heleno, R., Chamorro, S., Vargas, P., Mcmullen, C. K., Castro-Urgal, R., … Olesen, J. M. (2013). Invaders of pollination networks in the Galápagos Islands: Emergence of novel communities. Proceedings of the Royal Society B: Biological Sciences, 280(1758) ; Nnakenyi, C. A., Traveset, A., Heleno, R., Minoarivelo, H. O., & Hui, C. (2019). Fine-tuning the nested structure of pollination networks by adaptive interaction switching, biogeography and sampling effect in the Galápagos Islands. Oikos, 128(10), 1413–1423.",original publication
158,"Traveset et al., 2013",21,93,234,17,29,55,18,22,91,"23,8","1,685",463,97,12,30,"103,6","0,053",T,"65,79","San Cristobal Island, Galapagos", Galapagos Archipelago (Ecuador),"-0,89","-89,61",2011,"Traveset, A., Heleno, R., Chamorro, S., Vargas, P., Mcmullen, C. K., Castro-Urgal, R., … Olesen, J. M. (2013). Invaders of pollination networks in the Galápagos Islands: Emergence of novel communities. Proceedings of the Royal Society B: Biological Sciences, 280(1758) ; Nnakenyi, C. A., Traveset, A., Heleno, R., Minoarivelo, H. O., & Hui, C. (2019). Fine-tuning the nested structure of pollination networks by adaptive interaction switching, biogeography and sampling effect in the Galápagos Islands. Oikos, 128(10), 1413–1423.",original publication
164,"Trojelsgaard et al., 2015",24,98,236,13,41,68,24,36,111,"18,9","2,715",356,86,32,71,"84,2","0,036",TO,"69,67","Tenerife, Canary Islands",Canary Islands (Spain),"28,29","-16,66",2010,"Trøjelsgaard, K., Jordano, P., Carstensen, D. W., & Olesen, J. M. (2015). Geographical variation in mutualistic networks: Similarity, turnover and partner fidelity. Proceedings of the Royal Society B: Biological Sciences, 282(1802), 1–9. ",DRYAD:  http://dx.doi.org/10.5061/dryad.76173
167,"Devoto et al., 2005",28,80,170,16,27,63,24,40,86,"8,7","4,254",1064,54,4,60,92,"0,041",T,"54,63","Patagonia, Argentina", Argentina,"-40,64","-71,35",2003,"Devoto, M., Medan, D., & Montaldo, N. H. (2005). Patterns of interaction between plants and pollinators along an environmental gradient. Oikos, 109(3), 461–472.
Devoto, M. (2006). Interacciones planta - polinizador a lo largo de un gradiente ambiental : una aproximación en escala. Universidad de Buenos Aires.",master thesis
168,"Devoto et al., 2005",43,191,373,28,55,123,37,78,167,"7,8","4,434",755,64,14,60,412,"0,05",T,"47,86","Patagonia, Argentina", Argentina,"-40,76","-71,09",2002,"Devoto, M., Medan, D., & Montaldo, N. H. (2005). Patterns of interaction between plants and pollinators along an environmental gradient. Oikos, 109(3), 461–472.
Devoto, M. (2006). Interacciones planta - polinizador a lo largo de un gradiente ambiental : una aproximación en escala. Universidad de Buenos Aires.",master thesis
169,"Gibson et al., 2006",33,82,268,30,48,177,17,18,51,"9,3","4,622",829,16,72,90,60,"0,022",TO,"84,35","Bath, Somerset, UK", UK,"51,39","-2,47",2002,"Gibson, R. H., Nelson, I. L., Hopkins, G. W., Hamlett, B. J., & Memmott, J. (2006). Pollinator webs, plant communities and the conservation of rare plants: arable weeds as a case study. Journal of Applied Ecology, 43(2), 246–257. ",Dryad: https://doi.org/10.5061/dryad.41m4d
170,"Gibson et al., 2006",30,68,156,23,34,87,17,14,34,"9,5","4,567",859,18,36,90,30,"0,015",TO,"85,71","Langport, Somerset, UK", UK,51,"-2,94",2002,"Gibson, R. H., Nelson, I. L., Hopkins, G. W., Hamlett, B. J., & Memmott, J. (2006). Pollinator webs, plant communities and the conservation of rare plants: arable weeds as a case study. Journal of Applied Ecology, 43(2), 246–257. ",Dryad: https://doi.org/10.5061/dryad.41m4d
172,"Fragoso, 2014",19,111,167,13,47,69,13,41,63,"21,8","1,885",1459,74,65,336,198,"0,094",T,"23,08",Brazil,Brazil,"-21,12","-47,97",2012,"Fragoso, F. P. (2014). Restabelecimento das interações entre plantas e visitantes florais em áreas restauradas de Floresta Estacional Semidecidual. Universidade de Sao Paulo.",PhD thesis
173,"Orford et al., 2016",29,105,221,25,75,158,11,17,26,"9,3","4,577",735,14,50,120,28,"0,009",T,"87,31",South-West England,UK,"51,66","-2,16",2013,"Orford, K. A., Murray, P. J., Vaughan, I. P., & Memmott, J. (2016). Modest enhancements to conventional grassland diversity improve the provision of pollination services. Journal of Applied Ecology, 53(3), 906–915. ",original publication
175,"Aizen et al., 2008",18,57,181,15,17,60,18,22,86,"7,7","4,267",897,60,64,90,102,"0,099",TO,56,"Nahuel Huapi National Park, Patagonia, Argentina", Argentina,"-41,14","-71,32",2001,"Aizen, M. A., Morales, C. L., & Morales, J. M. (2008). Invasive mutualists erode native pollination webs. PLoS Biology, 6(2), 0396–0403 ; Morales, C. L., & Aizen, M. A. (2006). Invasive mutualisms and the structure of plant-pollinator interactions in the temperate forests of north-west Patagonia, Argentina. Journal of Ecology, 94(1), 171–180",original publication
176,"Aizen et al., 2008",17,58,169,15,21,47,17,23,90,"8,2","4,084",1218,57,30,90,102,"0,103",TO,56,"Nahuel Huapi National Park, Patagonia, Argentina", Argentina,"-41,05","-71,55",2001,"Aizen, M. A., Morales, C. L., & Morales, J. M. (2008). Invasive mutualists erode native pollination webs. PLoS Biology, 6(2), 0396–0403 ; Morales, C. L., & Aizen, M. A. (2006). Invasive mutualisms and the structure of plant-pollinator interactions in the temperate forests of north-west Patagonia, Argentina. Journal of Ecology, 94(1), 171–180",original publication
177,"Aizen et al., 2008",18,49,153,17,24,80,17,19,61,"8,4","3,92",1840,47,7,90,102,"0,116",TO,"58,21","Nahuel Huapi National Park, Patagonia, Argentina", Argentina,"-41,03","-71,81",2001,"Aizen, M. A., Morales, C. L., & Morales, J. M. (2008). Invasive mutualists erode native pollination webs. PLoS Biology, 6(2), 0396–0403 ; Morales, C. L., & Aizen, M. A. (2006). Invasive mutualisms and the structure of plant-pollinator interactions in the temperate forests of north-west Patagonia, Argentina. Journal of Ecology, 94(1), 171–180",original publication
179,"Benadi et al., 2013",23,28,60,13,16,25,14,9,29,"3,8","6,551",1298,29,26,98,72,"0,112",T,100,"Berchtesgaden National Park, German Alps, Germany", Germany,"47,54","12,89",2010,"Benadi, G., Hovestadt, T., Poethke, H. J., & Blüthgen, N. (2014). Specialization and phenological synchrony of plant-pollinator interactions along an altitudinal gradient. Journal of Animal Ecology, 83(3), 639–650.",DRYAD: https://doi.org/10.5061/dryad.8mn44
180,"Benadi et al., 2013",67,176,523,60,137,408,25,18,66,"1,5","6,25",1391,25,26,76,120,"0,01",T,"98,35","Berchtesgaden National Park, German Alps, Germany", Germany,"47,53","12,91",2010,"Benadi, G., Hovestadt, T., Poethke, H. J., & Blüthgen, N. (2014). Specialization and phenological synchrony of plant-pollinator interactions along an altitudinal gradient. Journal of Animal Ecology, 83(3), 639–650.",DRYAD: https://doi.org/10.5061/dryad.8mn44
192,"Grass et al., 2013",55,134,435,37,44,145,47,42,158,"17,9","2,31",1113,44,24,90,"177,4","0,024",TO,"38,62","Oribi Gorge Nature Reserve, KwaZulu-Natal, South Africa", South Africa,"-30,71","30,28",2011,"Grass, I., Berens, D. G., Peter, F., & Farwig, N. (2013). Additive effects of exotic plant abundance and land-use intensity on plant-pollinator interactions. Oecologia, 173(3), 913–923. ",original publication
203,"Robinson et al., 2018",8,24,41,8,16,32,3,3,4,"-16,3","13,865",97,54,0,40,"51,9","0,27",T,"65,62","Alexandra Fiord, Ellesmere Island, Nunavut, Canadian High Arctic",Canada,"78,88","-75,81",2014,"Robinson, S. V. J., Losapio, G., & Henry, G. H. R. (2018). Flower-power: Flower diversity is a stronger predictor of network structure than insect diversity in an Arctic plant–pollinator network. Ecological Complexity, 36(April), 1–6. ",original publication
205,"Bennett et al., 2018",32,132,399,30,63,193,28,42,125,"6,1","6,839",838,38,8,4,60,"0,014",TO,"84,15","Apuseni Mountains, Ghe?ari village, Roumania",Roumania,"46,49","22,82",2017,"Bennett, J.M., Thompson, A., Goia, I., Feldmann, R., Ştefan, V., Bogdan, A., et al. (2018). A review of European studies on pollination networks and pollen limitation, and a case study designed to fill in a gap. AoB Plants, 10, 1–10",original publication
206,"Adedoja et al., 2018",34,77,183,21,13,28,29,51,108,13,"3,246",698,50,26,90,"69,9","0,027",T,"20,72","Jonaskop Mountain, Western Cape Province, South Africa",South Africa,"-33,94","19,51",2017,"Adedoja, O. A., Kehinde, T., & Samways, M. J. (2018). Insect-flower interaction networks vary among endemic pollinator taxa over an elevation gradient. Plos One, 13(11), e0207453. ",original publication
207,"Cordiniz Picanco, 2018",16,40,112,13,26,74,12,6,19,"13,8","3,031",1283,40,12,122,60,"0,094",T,"85,71","Terceira Island, Azores archipelago",Azores archipelago (Portugal),"38,74","-27,3",2014,"Coderniz Picanço, A. L. (2018). Biodiversity conservation in island protected areas: the case of plant-insect pollinating networks. Universidade dos Açores Doutoramento.",original thesis
208,"Cordiniz Picanco, 2018",26,37,110,21,26,71,17,5,29,16,"2,949",1161,43,18,122,60,"0,062",T,"90,48","Terceira Island, Azores archipelago",Azores archipelago (Portugal),"38,77","-27,35",2014,"Coderniz Picanço, A. L. (2018). Biodiversity conservation in island protected areas: the case of plant-insect pollinating networks. Universidade dos Açores Doutoramento.",original thesis
209,"Cordiniz Picanco, 2018",24,40,147,21,22,81,21,9,49,16,"2,915",1172,44,22,122,60,"0,063",T,"93,75","Terceira Island, Azores archipelago",Azores archipelago (Portugal),"38,76","-27,19",2014,"Coderniz Picanço, A. L. (2018). Biodiversity conservation in island protected areas: the case of plant-insect pollinating networks. Universidade dos Açores Doutoramento.",original thesis
210,"Cordiniz Picanco, 2018",14,30,90,12,19,55,9,6,19,15,"2,976",1221,42,40,122,60,"0,143",T,"93,18","Terceira Island, Azores archipelago",Azores archipelago (Portugal),"38,7","-27,2",2014,"Coderniz Picanço, A. L. (2018). Biodiversity conservation in island protected areas: the case of plant-insect pollinating networks. Universidade dos Açores Doutoramento.",original thesis
211,"Cordiniz Picanco, 2018",14,34,101,13,22,67,10,8,26,"16,6","2,868",1133,46,42,122,60,"0,126",T,"95,83","Terceira Island, Azores archipelago",Azores archipelago (Portugal),"38,67","-27,11",2014,"Coderniz Picanço, A. L. (2018). Biodiversity conservation in island protected areas: the case of plant-insect pollinating networks. Universidade dos Açores Doutoramento.",original thesis
215,Benadi & Pauw 2018,38,80,235,19,18,39,22,22,69,"15,9","3,513",1051,60,18,37,97,"0,032",TO,"30,51",,South Africa,"-33,94","18,97",2017,"Benadi, G., & Pauw, A. (2018). Frequency dependence of pollinator visitation rates suggests that pollination niches can allow plant species coexistence. Journal of Ecology, 106(5), 1892–1901. ",original publication
216,"Hackett et al., 2019",43,220,527,32,136,310,36,46,140,"10,2","4,373",794,24,75,122,48,"0,005",T,"80,23",,UK,"50,72","-1,75",2013,"Hackett, T. D., Sauve, A. M. C., Davies, N., Montoya, D., Tylianakis, J. M., & Memmott, J. (2019). Reshaping our understanding of species’ roles in landscape-scale networks. Ecology Letters, 22(9), 1367–1377. ",original publication
217,"Hackett et al., 2019",21,53,96,17,37,57,16,10,28,"10,1","3,29",1139,14,23,122,24,"0,022",T,"44,59",,NZ,"-46,59","169,43",2015,"Hackett, T. D., Sauve, A. M. C., Davies, N., Montoya, D., Tylianakis, J. M., & Memmott, J. (2019). Reshaping our understanding of species’ roles in landscape-scale networks. Ecology Letters, 22(9), 1367–1377. ",original publication
218,"Nel et al., 2017",17,118,280,10,30,66,9,28,66,"21,4","3,182",601,80,10,152,200,"0,1",T,"25,19",,South Africa,"-24,41","30,89",2013,"Nel, L., Pryke, J. S., Carvalheiro, L. G., Thébault, E., van Veen, F. J. F., & Seymour, C. L. (2017). Exotic plants growing in crop field margins provide little support to mango crop flower visitors. Agriculture, Ecosystems and Environment, 250(January), 72–80. ",original publication
219,"Oleques et al., 2019",62,150,562,36,41,133,49,57,211,"19,4","3,38",1360,8,46,183,"130,8","0,014",TO,"45,28",,Brazil,"-30,1","-51,68",2015,"Oleques, S. S., Vizentin-Bugoni, J., & Overbeck, G. E. (2019). Influence of grazing intensity on patterns and structuring processes in plant–pollinator networks in a subtropical grassland. Arthropod-Plant Interactions, 13(5), 757–770. ",original publication
220,"Jolls et al., 2019",21,59,136,17,16,41,18,22,58,"6,3","9,512",770,25,8,41,"233,5","0,188",T,70,,USA,"45,71","-84,95",2015,"Jolls, C. L., Inkster, J. N., Scholtens, B. G., Vitt, P., & Havens, K. (2019). An endemic plant and the plant-insect visitor network of a dune ecosystem. Global Ecology and Conservation, 18, e00603. ",original publication
