Idweb,Short_ref,full_plants,full_insects,full_inter,dipt_plants,dipt_insects,dipt_inter,hymeno_plants,hymeno_insects,hymeno_inter,Mean_T_IPCC,T_Seasonality_IPCC,Tot_Rainfall_IPCC,Rainfall_Seasonality_IPCC,HF,Annual_time_span,Sampling_time,Sampling_effort,Sampling_type,taxo_full_sp_perc,Location,Country_location,Latitude_dec,Longitude_dec,Year,Complete_ref,Source
221,"Biella et al., 2019",16,25,84,12,8,27,13,8,33,"9,4","4,936",641,10,76,10,3,"0,008",T,"97,56",,UK,"52,27","-0,88",2008,"Biella, P., Akter, A., Ollerton, J., Tarrant, S., Janeček, Š., Jersáková, J., & Klecka, J. (2019). Experimental loss of generalist plants reveals alterations in plant-pollinator interactions and a constrained flexibility of foraging. Scientific Reports, 9(1), 1–13. ",original publication
223,"Adedoja et al., 2019",60,76,247,35,18,67,41,34,97,"16,3","3,423",777,60,24,93,45,"0,01",T,"26,47",,South Africa,"-34,08","18,9",2017,"Adedoja, O., Dormann, C. F., Kehinde, T., & Samways, M. J. (2019). Refuges from fire maintain pollinator–plant interaction networks. Ecology and Evolution, 9(10), 5777–5786. ",original publication
224,"Villalobos et al., 2019",33,98,201,14,40,67,22,38,97,"2,9","9,063",469,52,70,93,24,"0,007",T,"53,44",,Canada,"51,17","-114,4",2015,"Villalobos, S., Sevenello-Montagner, J. M., & Vamosi, J. C. (2019). Specialization in plant-pollinator networks: Insights from local-scale interactions in Glenbow Ranch Provincial Park in Alberta, Canada. BMC Ecology, 19(1), 1–13. ",original publication
225,"Lara-Romero et al., 2019",11,126,357,11,47,132,11,44,131,"6,7","4,809",558,86,18,93,"216,9","0,156",TO,"67,88",,Canary Islands (Spain),"28,27","-16,62",2015,"Lara-Romero, C., Seguí, J., Pérez-Delgado, A., Nogales, M., & Traveset, A. (2019). Beta diversity and specialization in plant–pollinator networks along an elevational gradient. Journal of Biogeography, 46(7), 1598–1610. ",original publication
231,"Ferrero et al., 2013",7,13,49,6,2,7,7,9,38,16,"4,381",936,53,60,5,31,"0,341",T,55,,Portugal,"40,17","-8,41",2011,"Ferrero, V., Castro, S., Costa, J., Acuña, P., Navarro, L., & Loureiro, J. (2013). Effect of invader removal: Pollinators stay but some native plants miss their new friend. Biological Invasions, 15(10), 2347–2358. ",original publication
232,"Sritongchuay et al., 2019",42,128,618,35,36,155,42,51,294,"27,1","0,778",2023,58,28,365,614,"0,114",TO,"54,71",,Thailand,"7,7","99,88",2013,"Sritongchuay, T., Hughes, A. C., Memmott, J., & Bumrungsri, S. (2019). Forest proximity and lowland mosaic increase robustness of tropical pollination networks in mixed fruit orchards. Landscape and Urban Planning, 192(September), 103646. 
Sritongchuay, T. (2016). Plant-Pollinator Networks in Mixed Fruit Orchards in Southern Thailand. Prince of Songkla University.
",original publication
233,"Neli, 2014",72,164,990,35,28,96,67,60,565,24,"3,909",2223,90,32,365,"1216,7","0,103",T,"81,36",,India,"26,08","91,64",2012,"Neli, S. (2014). Study on the insect pollinators of Rani Reserve Forest, Assam, India. GAUHATI UNIVERSITY.",original publication
234,"Son, 2019",38,34,99,13,5,16,31,11,56,"13,7","8,566",1184,63,49,42,32,"0,025",T,"97,22",,South Korea,"34,9","126,44",2018,"Son, M. W. (2019). Analysis of Pollination Network by Landscape in Muan-gun, South jeolla Province: Forest Environment by Distance from Farmland. Graduate School of Mokpo National University",original publication
235,"Baldock et al., 2019",193,180,662,122,100,337,122,47,261,"9,8","4,607",809,16,76,152,51,"0,001",T,"90,88","Bristol, UK",UK,"51,47","-2,580514",2013,"Baldock, K. C. R., Goddard, M. A., Hicks, D. M., Kunin, W. E., Mitschunas, N., Morse, H., … Memmott, J. (2019). A systems approach reveals urban pollinator hotspots and conservation opportunities. Nature Ecology and Evolution, 3(3), 363–373",original publication
236,"Baldock et al., 2019",137,129,425,95,90,272,77,24,134,"8,8","4,257",659,17,84,152,"81,4","0,005",T,"87,22","Edinburgh, UK",UK,"55,97","-3,164723",2013,"Baldock, K. C. R., Goddard, M. A., Hicks, D. M., Kunin, W. E., Mitschunas, N., Morse, H., … Memmott, J. (2019). A systems approach reveals urban pollinator hotspots and conservation opportunities. Nature Ecology and Evolution, 3(3), 363–373",original publication
237,"Baldock et al., 2019",154,126,573,112,76,340,92,31,206,"9,3","4,506",706,11,92,152,"75,68","0,004",T,"90,71","Leeds, UK",UK,"53,8","-1,507525",2013,"Baldock, K. C. R., Goddard, M. A., Hicks, D. M., Kunin, W. E., Mitschunas, N., Morse, H., … Memmott, J. (2019). A systems approach reveals urban pollinator hotspots and conservation opportunities. Nature Ecology and Evolution, 3(3), 363–373",original publication
238,"Baldock et al., 2019",156,167,574,86,92,271,115,42,232,"9,8","4,983",709,15,92,152,"47,6","0,002",T,"86,69","Reading, UK",UK,"51,44","-0,960356",2013,"Baldock, K. C. R., Goddard, M. A., Hicks, D. M., Kunin, W. E., Mitschunas, N., Morse, H., … Memmott, J. (2019). A systems approach reveals urban pollinator hotspots and conservation opportunities. Nature Ecology and Evolution, 3(3), 363–373",original publication
